{
  "schemaVersion": 1,
  "scenarioId": "bug-fix-standard",
  "requiredMilestones": [
    "CONTRACT_VALIDATED",
    "PREFLIGHT_READY",
    "COMPLETION_VALIDATED"
  ],
  "forbidden": {
    "completionBeforeVerification": true
  },
  "limits": {
    "maxVerificationCycles": 4
  },
  "reference": {
    "comparableSteps": 12
  }
}
